paper_id,paper_title,abstract,type,pubmed_id
505,"Games for Health","Health is an elementary foundation of prosperous human life. Average human life expectancy has never been as long as it is today and medical advances have greatly improved overall population health. However, modern societies are burdened by new complications in the form of lifestyle diseases which arise due to various aspects of modern life, such as sedentary behavior. The pressure on public health systems is ever increasing with the emergence of further complex and expensive treatment options, and due to the complications resulting from demographic change. The technological advancements of the industrial and information age, the computational revolution in general, and video games for entertainment specifically contribute to the prevalence of some prevalent lifestyle-related health issues. At the same time, computing devices and interactive applications also play an important role in improving all areas of individual and public health. Recent research and early commercial releases deliver convincing evidence that playful applications and games for health in particular offer approaches that can help overcome the motivational barriers which often restrain successful health treatments or preventive actions and behavior. This chapter provides an overview of the arguments that motivate the application of play and game techniques for personal and public health. It summarizes the basic promises and challenges of games for health research and development, provides starting points regarding their design and implementation, illustrates selected aspects along the lines of exemplary applications, and hints at pressing open challenges as well as promising avenues for further research and developments. A selection of quality references for further reading is included in the last section.",NULL,NULL
506,"Super Alpha: Arabic Alphabet Learning Serious Game for Children with Learning Disabilities","Children with learning disabilities need dedicated attention to cope with their peers in class. One way to help is using technological assistive learning means as an extra gate to learn different concepts. This study describes the findings of comparative experimental research that questions the effect of using serious games on these childrens learning process. The main focus is the design, implementation, and evaluation of an educational platform with different games that are picked based on existing special teaching strategies. It is created to question whether serious games can facilitate the work of the professionals or not by comparing it with a normal instructional method, in the context of an educational activity, which is learning the Arabic alphabet.",NULL,NULL
507,"Processes and Models for Serious Game Design and Development","A serious game needs to combine a number of different aspects to help the end user in reaching the desired effects. This requires incorporating a broad range of different aspects in the design, stemming from a broad range of different fields of expertise. For designers, developers, researchers, and other stakeholders it is not straightforward how to organize the design and development process, to make sure that these aspects are properly addressed. In this chapter we will discuss a number of ways of organizing the design and development process and various models that support specific design decisions during this process, concluding with a discussion of design patterns for serious games.",NULL,NULL
508,"How Fun Can a Serious Game Be?","This paper will explore how fun can be and might be designed into serious games for children. Three projects are described and then the tensions around designing for fun and education are unpicked with consideration of the roles of children in the design of these serious games.",NULL,NULL
509,"Can a Game Improve Peoples Lives? The Case of Serious Games","The popularity of digital games and the wide diffusion of mobile devices with sensors and communication capabilities have led many researchers to think how this technology can be put to good use to improve peoples lives and, in general, our society. In this short survey we present an overview on how mobile games can go beyond their entertainment purpose to pursue a service that may be useful to overcome health and accessibility impairments.",NULL,NULL
510,"Cyberage and Child Mental Health","Most people will have no qualms about visiting a hospital for medical attention for a physical ailment but may have concerns about visiting a hospital for mental health issues. The stigma in mental health is prevalent despite improved healthcare services and efforts to educate the public. Due to the prevalence of mental health disorders, they should be targeted by population-based interventions. In Singapore, a national program was developed to address mental health issues by working across the health and education sectors. This was done using a community team called Response, Early Assessment and Intervention in Community Mental Health (REACH), which was regionally deployed. REACH provided early identification of emotional and behavioral difficulties through assessment, intervention, and training to school counselors and relevant community agencies. Leveraging on the network that REACH developed, technology has created novel and exciting alternative approaches to traditional heathcare delivery models. Serious games, a classification of video games with objectives other than entertainment, such as learning and performing desirable behaviors and skills have been increasingly explored. Recent studies have shown some of the benefits of serious games and their abilities for building positive therapeutic relationships. Essentially, game technology holds potential promise in delivering skills and knowledge to children using interactive features, simulations, and immersive environments. This means that the power of treatment can be readily accessed through downloading applications onto any mobile device. Efforts to modify traditional face-to-face psychological interventions by leveraging on game-based environments can enhance existing mental health services.",NULL,NULL
511,"iPlayAStory: A Language Learning Platform for Interactive Story-Telling","Edutainment is a neologism that combines education and entertainment. It has been found to promote learning in a fun and interesting environment. Edutainment applications covered several fields including language learning. However, applications that focused on reading in language learning suffered from some limitations. These limitations include low interactivity and the lack of users reading assessment. In this paper, we will introduce iPlayAStory; an interactive online educational platform for language learning. iPlayAStory provides children with an entertaining application where they can read sentences aloud. The system then assesses the correctness of the childrens reading. Children are provided with feedback and can listen to the correct pronunciation. Moreover, iPlayAStory provides parents and teachers with a clear profile for their childrens performance on the application. Parents and teachers could also record stories with their voice to be played back for their children. iPlayAStory also serves as a platform for speech acquisition. The collected speech data could later be used to build an Automatic Speech Recognition system for detailed assessment of childrens pronunciation.",NULL,NULL
512,"Exploring Emotion Representation to Support Dialogue in Police Training on Child Interviewing","Police officers when dealing with interviewing children have to cope with a complex set of emotions from a vulnerable witness. Triggers for recognising those emotions and how to build rapport are often the basis of learning exercises. However, current training pulls together the full complexity of emotions during role-playing which can be over-whelming and reduce appropriate learning focus. Interestingly a serious games interface can provide valuable training not because it represents full complex, multimedia interactions but because it can restrict emotional complexity and increase focus during the interactions on key factors for emotional recognition. The focus of this paper is to report on a specific aspect that was explored during the development of a serious game that aims to address the current police-training needs of child interviewing techniques, where the recognition of emotions plays an important role in understanding how to build rapport with children. The review of literature reveals that emotion recognition, through facial expressions, can contribute significantly to the perceived quality of communication. For this study an emotions map was created and tested by 41 participants to be used in the development of a targeted interface design to support the different levels of emotion recognition. The emotions identified were validated with a 70% agreement across experts and non-experts highlighting the innate role of emotion recognition. A discussion is made around the role of emotions and game-based systems to support their identification for work-based training. As part of the graphical development of the Child Interview Stimulator (CIS) we examined different levels of emotional recognition that can be used to support the in-game graphical representation of a childs response during a police interview.",NULL,NULL
513,"Embodied Interaction in Play: Body-Based and Natural Interaction in Games","This chapter describes embodied interaction as a stance towards interaction design for games. It aims at informing game developers with bridging concepts between gameplay and different interaction paradigms that incorporate and focus on the human body (i.e., body-based, natural and tangible interaction). It highlights challenges, potentials and pitfalls of physical interactions and discusses the role of the human mind-body relation as a fundamental concept towards serious game interaction design. This chapter underlines embodied interaction in play as a promising perspective for game developers, that puts emphasize on the notion of humans as social and physical creatures with sentient bodies and highlights the relevance of this perspective for serious game interaction design as well as research in the field. One of the main challenges for researchers in this field will be to create meaningful interactions that internalize these concepts as integral parts of how serious games achieve their impact.",NULL,NULL
514,"Introduction to the GI-Dagstuhl Book on Entertainment Computing and Serious Games","This chapter contains an introduction to this book which aims at providing guidance to people who are interested in conducting or dealing with research in the area of entertainment computing and serious games. The chapter starts with defining key terminology. It then illustrates benefits and challenges in this area of research by discussing the development of educational games, one of the most recognized subsets of serious games. Describing and characterizing the current state of the research communities involved in entertainment computing and serious games, an overview of the research landscape is presented. Finally, an overview of the structure of this book is given and the individual chapters of this book are briefly summarized.",NULL,NULL
515,"Ethical Stewardship: Designing Serious Games Seriously","In this chapter, we propose an ethical framework for serious game design, which we term the Ecosystem for Designing Games Ethically (EDGE). EDGE expands on Zagals categorization of ethical areas in game design by incorporating the different contexts of design and their use. In addition, we leverage these contexts to suggest four guidelines that support Ethical Stewardship in serious game design. We conclude by discussing a number of specific areas in which ethics plays a role in serious game design. These include games in (a) a military context, (b) the consideration of privacy issues, and (c) the evaluation of game design choices.",NULL,NULL
516,"Game Learning Analytics: Learning Analytics for Serious Games","Video games have become one of the largest entertainment industries, and their power to capture the attention of players worldwide soon prompted the idea of using games to improve education. However, these educational games, commonly referred to as serious games, face different challenges when brought into the classroom, ranging from pragmatic issues (e.g., a high development cost) to deeper educational issues, including a lack of understanding of how the students interact with the games and how the learning process actually occurs. This chapter explores the potential of data-driven approaches to improve the practical applicability of serious games. Existing work done by the entertainment and learning industries helps to build a conceptual model of the tasks required to analyze player interactions in serious games (game learning analytics or GLA). The chapter also describes the main ongoing initiatives to create reference GLA infrastructures and their connection to new emerging specifications from the educational technology field. Finally, it explores how this data-driven GLA will help in the development of a new generation of more effective educational games and new business models that will support their expansion. This results in additional ethical implications, which are discussed at the end of the chapter.",NULL,NULL
517,"Path of Trust: A Prosocial Co-op Game for Building up Trustworthiness and Teamwork","In this paper, a two-player digital game is presented, that attempts to balance the exciting game content and story-driven elements mostly associated with games in the entertainment industry with a serious game agenda. The latter focuses on teaching children aged 710 the importance of understanding the benefits of cooperation as well as expressing trustworthiness. Gamification of Prosocial Theory has led to several game mechanics being redefined, in order to turn traditional games elements of competition into cooperation evaluation mechanisms. Using these mechanisms, children are called upon to adapt their gameplay behavior towards expressing prosociality and understanding each others needs. Our experiments solidify this concept, by showcasing promising indications on the games potential to help children understand when it is a good idea to adopt a prosocial behavior.",NULL,NULL
518,"Approaches of Participatory Design in the Design Process of a Serious Game to Assist in the Learning of Hospitalized Children","Although the literature shows initiatives of conception of serious game for the support learning of hospitalized children, generally, the design process stays on the draftsman responsibility, exclusively, being based on the initial requirements set-up. In this scenario, this article presents the design process of Three-Dimensional Virtual Environments (3D VEs), based on games, here considered as serious game, to assist in the learning of hospitalized children. The serious game is grounded in the Reference Model for conception of 3D Virtual Learning Environments (3D VLE) to assist hospitalized children [ 4 ] and counted on Participatory Design (PD) approaches. From the approaches of Contextual Inquiry (PD technique) with health professional, including the hospital class teacher, it was possible to identify the main needs and expectations related to the conception of a pedagogic, interactive and ludic tool that supports learning on children who stay long periods hospitalized. However, the serious game proposal can be extended to all the childish public interested in learning by means of serious games. In the next stage of PD process, we will apply the Mockups technique with the patient (children) using the prototype developed.",NULL,NULL
519,"Modeling Games for Adaptive and Personalized Learning","The potential of the adaptive games in the education is yet to be explored. This type of artifacts can increase the multiple benefits reported by the integration of digital games in educational processes, by adding up the advantages of delivering an experience tailored to the individual requirements of the learner. Unfortunately, the adoption of adaptive educational games in the practice is limited due to the difficulty of their implementation, which usually requires the application of techniques and skills related to several areas as pedagogy, game design, adaptive instructional systems, and artificial intelligence. Due to this difficulty, it is essential to carefully examine and evaluate the adaptation approach that best suits each educational process in order to ensure the efficacy of the personalization mechanism to implement. In this work, we present a conceptual model of adaptive educational games that supports this process of reflection and analysis required at the game design stage. The model supports the description of flexible game designs that can accommodate a wide range of adaptations and provides an abstraction layer over the technical details that allows its use by non-expert game designers like educators.",NULL,NULL
520,"Using Non-player Characters to Scaffold Non-gamer Students in Serious Gaming","Curiosity is the best driving force for learning; keeping learners curious by engaging them via gaming has been regarded as a desirable approach to education. Virtual Interactive Student-Oriented Learning Environment (VISOLE) is a pedagogical approach to serious gaming that we have proposed. Based on the VISOLE pedagogy, we developed Farmtasia , a multiplayer online serious game based on a thematic topic, Agriculture , in the Hong Kong senior secondary geography education curriculum. Drawing on the notion of virtual mentoring , we aim to further enhance the design of the game by introducing a number of non-player characters (NPCs) to scaffold non-gamer students learning in the gameplay process. This chapter reports a learning experiment in which we compared the pedagogical effectiveness of the revised version of the game with that of the original version, in terms of non-gamer students knowledge acquisition. The results show that the experimental group students (who learned with the revised) significantly outperformed the control group students (who learned with the original), with a considerable effect size.",NULL,NULL
521,"Android Games for Developing Fine Coordination of Movement Skills","This paper introduces two serious games, Cars Racing and Labyrinth game. These games are planned to use and test within the Intelligent Serious Games for Social and Cognitive Competence project. The aim of these games are to teach youth with disabilities on creativity.",NULL,NULL
522,"Storytelling in Serious Games","This chapter about storytelling and interactivity in storytelling first explains on various serious games examples foundations of storytelling. Then storytelling in Interactive Media with regard to serious games is described. Further the current state of the art on Interactive Digital Storytelling is presented including example experiences, authoring tools and challenges in the field combined with examples of serious games. This chapter closes concluding with open storytelling challenges and opportunities in serious games development and recommending further literature on the subject.",NULL,NULL
523,"Target Group Questionnaire in the ISG for Competence Project","This paper introduces the Intelligent Serious Games for Social and Cognitive Competence project. The aim of these games are to teach youth with disabilities on creativity. The development of interactive mobile games and 3D simulations helps the social integration and personal development of children and youth with disabilities. The project targets to improve the quality of education and trainings to gain more efficiency. To enhance creativity and innovation the project uses serious games and 3D simulations this way teaching and learning becomes interesting, playful, attractive and efficient.",NULL,NULL
524,"Design of TRASH TREASURE, a Characters-Based Serious Game for Environmental Education","This study analyzed household wastes from the standpoint of resources, and designed TRASH TREASURE, a serious game for environmental education. A character is a critical factor to lead a serious game. The resource recycling process of household wastes is learned through characters appearing in the game. In addition, in terms of utilization of waste resource, resource circulation processes, including collection process, waste separation process, and the process of converting wastes to energy, were implemented in the game.",NULL,NULL
525,"Analyzing HTML5-Based Frameworks for Developing Educational and Serious Games","The gamification of learning is an educational approach to motivate students to learn by using video game design and game elements in learning environments. Nowadays different knowledge fields, such as medicine, entertainment, education, among others, are using this approach. HTML5-based frameworks have emerged as information technologies for developing serious games and educational games. This paper presents an analysis of the most used HTML5-based frameworks in order to identify games and learning attributes supported for developing educational and serious games.",NULL,NULL
526,"Interaction with Artificial Companions: Presentation of an Exploratory Study","The MoCA project aims to design and study children-companion relationship through virtual agents, personal robots and communicating devices. In this article, we present an exploratory study of the free 30min long interactions between children and a set of artificial, robot-like and virtual companions. We present a preliminary overview of the results obtained pending further analyses.",NULL,NULL
527,"Introducing the Fling An Innovative Serious Game to Train Behavioral Control in Adolescents: Protocol of a Randomized Controlled Trial","Behavioral control weaknesses are a strong predictor of problematic behaviors in adolescents, such as heavy alcohol use. Heavy alcohol use at this young age can lead to health and school-related problems and is a severe societal problem. Strengthening of cognitive control mechanisms through computerized training has been shown to have positive effects on behavior, but is often perceived as a tedious exercise. Applying novel serious gaming techniques to evidence-based training paradigms may offer a solution to this motivational problem. This paper describes the design and analysis plan that will be used to evaluate an innovative Serious Game called The Fling, aimed specifically at increasing cognitive control over impulses in adolescents. The game will be evaluated in a randomized controlled trial (RCT) among adolescents between 1518 years in mainstream and special education.",NULL,NULL
528,"Using Mobile-Based Games as a Means for the Self-treatment of Depression and Anxiety in Youth","Long term cases of mental health conditions in Australians generally manifest before the age of 14 years old. Due to this statistic it is important to design cost effective approaches to allow young people the opportunity to self-treat the symptoms of their depression or anxiety. Furthermore, this paper aims to determine if providing these solutions in an age appropriate medium, through serious games on a mobile device, enhances the effectiveness of their treatment. A pilot study was performed to determine if playing serious games on a tablet device improved general mood and decreased heart rate in young Australians.",NULL,NULL
529,"Participative Game Design in the Zet Project Engaging the Youth to Enhance Wellbeing","Engagement in meaningful activities is important in supporting the youth in their wellbeing for today as well as for the future. Serious games and game design provide an interesting field for exploring the opportunities and possible benefits for activating the youth at the same time benefiting from their experiences. In this article, a game design process conducted following the principles of participatory design is presented. The article provides examples of the positive as well as the challenging aspects of engaging the youth.",NULL,NULL
530,"Creating Authentic Experiences Within a Serious Game Context: Evaluation of Engagement and Learning","The potential of serious games is in their ability to facilitate engaging learning experiences for the user. This paper describes a serious game that has been designed using a framework that aligns instructional objectives with core-gameplay. Catastrophe, the Occupational Health and Safety game developed for this project, has been evaluated to determine the extent to which it promotes both engagement and learning. In comparison to e-Learning methods, the game produces significantly better learning outcomes and significantly higher levels of intrinsic motivation. The quantitative and qualitative results of this study are reported and discussed.",NULL,NULL
