paper_id,paper_title,abstract,type,pubmed_id
161,"Simplifying the Validation and Application of Games with Simva","The suitability of games for learning has been proven for many years. However, effective application of games in education requires two important stages: their initial validation, and their later use in the classroom. Serious games should be validated prior to exploitation to prove their efficacy and usefulness as tools for teachers, via larger experiments that include data collection, either from in-game interactions or from external questionnaires; this, in turn, requires dealing with data privacy regulations and informed consent. Once validated, serious games can then be applied in educational environments, where their effective application is closely linked to the tools and preparation available to the teachers and educators that use them. In this paper, we revise the steps and considerations that need to be dealt with both when conducting experiments with games and, later, when applying them as part of teaching in educational scenarios. For both these stages, we provide guidance and recommendations to simplify stakeholders tasks, including the use of the tool Simva , which simplifies the management of users, questionnaires, privacy, data collection, and storage.",NULL,NULL
162,"Optimized User Experience Design for Augmentative and Alternative Communication via Mobile Technology: Using Gamification to Enhance Access and Learning for Users with Severe Autism","One of the most significant disabilities in autism spectrum disorder (ASD) includes a delay in, or total lack of, the development of spoken language. Approximately half of those on the autism spectrum are functionally non-verbal or minimally verbal and will not develop sufficient natural speech or writing to meet their daily communication needs. These individuals receive intervention in the area of augmentative and alternative communication (AAC) using mobile technologies. AAC services ideally should be provided starting at an early age but many young learners experience some degree of difficulty in gross and fine motor functioning that prevents accessing and benefitting from mobile AAC applications. A suite of evidence-based iPhone  applications, SPEAKall! Lite  and SPEAKplay!  , was developed to help learners with ASD (a) acquire initial speech and language skills, and (b) train critical gestures needed to fully access mobile touch screen devices. SPEAKplay! trains the performance of gestures including Directed and Sustained Touch, Drag and Drop, and Vertical and Horizontal Swipe through a gamification approach. Serious game design principles guided the creation of three arcade-style games including Pop the Bubbles , Fly the Rocket , and Feed the Dino . Initial usability testing with experienced AAC practitioners indicated SPEAKplay! to be a potentially viable intervention tool.",NULL,NULL
163,"Ar-Math: Augmented Reality Technology Applied for Education","Currently, technology opens the doors to a new generation of methodologies in the teaching of various subjects. Serious games" are a tool that allows students to learn while playing, which has several cognitive and social benefits. Augmented reality by its sensory element becomes a tool suitable for application in serious games for young ages. This paper presents a serious game for teaching numerical place value for children upto 6 years, we called as AR-Math.",NULL,NULL
164,"Generation of Adapted Learning Scenarios in a Serious Game: Lessons Learnt","This article presents the lessons we learnt during the development of a generation component in the Escape it! learning game. They are presented according to the different development stages of the generator. They may be considered useful by designers or researchers sharing similar contexts and objectives.",NULL,NULL
165,"Designing a Serious Game to Raise Awareness of Intimate Partner Violence Among Adolescents in the UK: The Use of Good Games Principles for Effective Behavioural Change","Due to the popularity of video games in modern society, serious digital games have the potential to promote prosocial thoughts and behaviours, as well as increase empathy and helping behaviour. However, to make a successful prosocial game a number of good game principles need to be met to make the game as immersive and engaging as possible. This paper discusses how the design decisions and overall game framework used to develop a serious, prosocial game that aims to help raise awareness and promote prosocial behavioural changes towards intimate partner violence in the United Kingdom, successfully meets these good game principles to create an effective educational, immersive and engaging game experience.",NULL,NULL
166,"Evaluation Methods for the Effective Assessment of Simulation Games","Simulation games play an important role in the area of technology-based education. They allow the simulation of real-world problems in a risk-free environment and thereby intend to increase the learning experience of students. However, assessing the effectiveness of a simulation game is necessary to optimize elements of the game and increase the learning effect for students. For this, different evaluation methods exist, which do not always cover all phases when running a simulation game. In this study, we conduct a literature review to analyze evaluation methods for the pre-game, in-game, and post-game assessment of simulation games. In accordance with our inclusion criteria, we selected 31 peer-reviewed articles, and categorized them according to a didactic framework that describes four phases of running simulation games: Preparation, Introduction, Interaction and Conclusion phase. Based on the results, we provide a concrete evaluation strategy that can be used to assess simulation games throughout all phases. This study contributes to theory by providing an overview of evaluation methods for the assessment of simulation games within the different game phases. It contributes to practice by providing a concrete evaluation strategy that can be adapted and used to assess simulation games.",NULL,NULL
167,"Applying and Facilitating Serious Location-Based Games","The popularity of location-based games continues unabated and is benefiting from the increasing use of mobile end devices and advantageous general conditions, such as the Internet of Things and the Smart City paradigm. This enormous potential of engagement should also be tapped for serious location-based games, i.e. the use of location-based games beyond the purpose of entertainment. The workshop Applying and Facilitating Serious Location-based Games aims to contribute to the development of this potential. In the article, the theoretical basis for this workshop is derived and corresponding frameworks are presented.",NULL,NULL
168,"Serious Game Design for and with Adolescents: Empirically Based Implications for Purposeful Games","Serious games have been successfully implemented in many fields in recent years. Along the way, the call for audience specific solutions rose within the game community. In the course of a project focusing on fostering social media literacy among adolescents, we have developed a design for a serious game tailored to this specific age group. We present the results of a survey conducted among Austrian youths ( $$N=86$$ N = 86 ) in which the participants reported on their gaming preferences and habits. The results are supplemented with data from participatory design workshops. Considering prospective players, their resources, play environments, and the games characteristic goal, we provide general directions for serious game design for adolescents and address ethical questions.",NULL,NULL
169,"Towards an Improvement of Interpersonal Relationships in Children with Autism Using a Serious Game","Autism Spectrum Disorder (ASD) or Autism is considered as a psychological neurodevelopment disorder which affects people. It is characterized by a wide range of conditions that difficult their social skills, as well as their verbal and non-verbal communication. According to the Centers for Disease Control, Autism affects an estimated 1 in 59 children in the USA. Technological advances seek to benefit the most vulnerable groups of society, creating tools that enhance the development of their abilities and skills. In this sense, Serious Games are structure-oriented videogames designed to learning or therapies in a fun environment. With this principle, JOINME game was developed using a natural user interface to benefit the progress of interpersonal relationships in children aged between 5 and 10, diagnosed with high-functioning ASD. For experimentation, a case study was applied. It was built from the adaptation of the KidsLife scale through a pre-test and post-test. As a result, a significant improvement of 8.17% in the development of interpersonal relationships was obtained in the kids. It reinforced their mathematical reasoning, recognition of emotions, and comprehensive reading.",NULL,NULL
170,"Accessibility and Serious Games: What About Entity-Component-System Software Architecture?","Video games are an integral part of popular culture. The video game industry faces challenges with the increase in players numbers and application areas including serious games. The increase in the number of players includes disabled players. Therefore, serious games have to consider these audiences who may be affected by one or more temporary or ongoing disabilities. Universally accessible games (UA-Games) aim to create interfaces that can be accessed and manipulated by the largest number of players. Currently few serious games include accessibility features, while accessibility should be considered at the beginning of the serious game design. Then how can we help designers and developers to include accessible features in an existing serious game? To this end, game engines must be efficient but also scalable and modular. This paper studies the interest of the Entity-Component-System (ECS) software architecture to integrate accessibility features in an existing serious game. As a case study, we will take a serious game developed with ECS yet not accessible: E-LearningScape. We will present the accessible features that we have integrated into the serious game and discuss the pros and cons of this approach. This feedback shows us that ECS provides very useful design flexibility to integrate unanticipated interaction features into serious games.",NULL,NULL
171,"Collect the Bones, Avoid the Cones: A Game-Based App for Public Engagement","Game-based applications (apps) and serious games enable educationalists to teach complex life sciences topics. Gamification principles (i.e. challenges, problem solving, critical thinking) improve learners motivation and can also help science communicators discuss important scientific subjects and their real-world context in an effective, enjoyable manner. The aim of this study was to design, develop and evaluate a science communication game-based app, entitled Collect the Bones, Avoid the Cones, on human skull anatomy for use in public engagement activities with younger audiences. Specifically, the app contextualised three-dimensional (3D) skull anatomy within a narrative about cycling and helmet safety. The app was tested at the Glasgow Science Centre, with ethical approval from the Glasgow School of Art, to assess its potential pedagogical value, in terms of pre- and post-app knowledge and confidence, and general user evaluation. In total, 50 participants were recruited (mean age 15.61.647, range 764) with 62% of participants aged 712. Usability and educational value were rated highly with 70% of participants agreeing they could use the app without any external instructions and 90% agreeing they understand the anatomy of the skull better after app use. The enjoyability of the game was also positively perceived with 94% of participants agreeing they enjoyed the game. Although there was no statistical significance in pre- and post-app knowledge scores, there was a statistically significant increase in players confidence relating to skull anatomy (pre-app: 3.001.265, post-app: 4.001.00, Z =5.111, p <0.001). These results provide promising insight into the potential of game-based apps for public engagement in anatomical sciences. Future research on how the app influences attitudes towards helmet use in different demographic groups would be valuable in identifying its full pedagogical potential.",NULL,NULL
172,"Gamification in Cultural Heritage: A Tangible User Interface Game for Learning About Local Heritage","During recent years, information and communication technologies have widely affected the cultural heritage sector, offering incredible opportunities to enhance the experiential value of heritage assets. Digital tools are powerful instruments for improving the cultural activities, and at the same time, they represent new paradigms for enhancing the diffusion and acquisition of the cultural message. Techniques such as augmented reality, virtual reality and, more broadly, all multimedia technologies, are offering the visitors new opportunities of interaction with the cultural activities. Furthermore, another trend has gained significant attention: increasing users engagement through gamification. Several studies have showed the efficacy of gamification and serious games in learning, revealing improvements in learning achievements. This research aims at investigating and proposing new tools to improve the interest of students in cultural heritage and enhance their learning experience. We describe the design, development and use of a game addressed mainly to primary school students, which utilizes computer vision techniques and computer graphics to raise their engagement during educational workshops at the Caracciolo Castle in the town of Sammichele di Bari (Bari, Italy). The game combines manual activities with visual information in computer graphics, showed in a digital screen. The interaction with the player relies on a tangible user interface based on computer vision techniques. Our system utilizes a simple web camera, which recognizes the users interactions with the tangible game board during the game, and guarantees a kinesthetic learning process. In this paper, we provide detailed descriptions of the system and, afterwards, we discuss the possible implications.",NULL,NULL
173,"A Self-adaptive Serious Game forEye-Hand Coordination Training","In this study, we propose a self-adaptive game aiming auxiliary in eye-hand coordination and short-term training. The game requires a player to pop specific balloons appearing in a screen aiming to prevent that they fly. The game uses the Dynamic Difficulty Adjustment (DDA) technique for verifying reaction time, pragmatic six-step plan for implementing adaptive difficulty proposed, and a Leap Motion controller as an input device. The adaptive difficulty of the game is implemented through Q-Learning, a Reinforcement Learning algorithm. We conducted experimental tests with ten participants (ages between 16 and 23 years). We evaluated the games learning effect by comparing velocity by episodes and accumulated reward by episodes for each player. We also evaluated the user experience using the System Usability Scale (SUS). Experimental results suggest that players accumulated positive rewards according to the velocity of the game adjusted to the profile of the user, taking it to a level of adequate and challenging difficulty at the same time. The SUS score per player shows that the game adapted dynamically difficulty being satisfactory. The study shows that the game implemented can contribute to eye-hand coordination training positively.",NULL,NULL
174,"Immersive Virtual Reality App to Promote Healthy Eating in Children","An immersive virtual reality application was developed as a serious game to support children on their decisions about food, the system was composed by the Gear VR (Viewer and controller), and a phone which contains the mobile application developed in Unity, providing the immersive environment, the platform was based on a path where the player has to go through it choosing between different sort of meals and also between different physical activities, the effect of balanced diet plus adequate physical activity seems reflected on the avatar previously chosen by the user, the app was tested on 12 children between 8 and 10 years old during one week, children participated on the study after receiving an informed consent, analyzing the tendencies of food choice on children before and after, a notorious positive effect could be seen on the users according to the avatar analyzed at the end of the round, besides a System usability ore was also applied to evaluate the degree of usability of the app, reaching a ore of 88.33% which rates the app as very usable, this results were even better than what was planned at the beginning of the experience.",NULL,NULL
175,"Analysis of Mixed Reality Tools for Learning Math in Primary and Secondary School","In our study, we provide a state of the art on Mixed Reality (MR) learning tools for teaching math in primary and secondary school. Through a detailed analysis of eight representative applications, we provide an overview of the MR applications currently used, their educational objectives, the augmentations and interactions they offer, the technologies they use, their advantages and their limitations. We conclude by identifying several remaining challenges that need to be addressed in order to benefit from the full educational potential of MR for teaching math in schools.",NULL,NULL
176,"in-Game Raw Data Collection and Visualization in the Context of the ThimelEdu Educational Game","The widespread use of computer-based learning environments and the rise of big data have positioned learning analytics as a fundamental component of educational technology. Learning analytics provides methods for capturing and assessing student behaviors. In game-based learning environments, however, the development and integration of learning analytics has not yet reached their full potential. Research thus far has focused on the specification of learning analytics frameworks, implementation of different techniques and methods for the collection of data, and the development of automated assessment tools. Unfortunately, much work overlooks the importance of strategic data collection and therefore risks basing decisions on flawed or incomplete data. In this paper, we present our library that seeks to capture data in the context of a serious game, designed to be compatible with the Experience API (xAPI) and implemented in the Unity 3D game engine. Through this work, we aim to emphasize and extend the use of learning analytics in serious games, simplify the production of data, and record events with educational value.",NULL,NULL
177,"A Game-Based Service to Mitigate the Risk of Inundations Caused by Solid Waste Accumulation","The number of people living in metropolitan areas of Mexico has steadily grown over the last decades. However, a lack of proper regulations has led to various consequences. An example of this is the mishandling of solid waste. A 2018 study reported that, in our country, 27% of solid waste remains in the cities, and only 12% is recycled. For that reason, garbage accumulation on urban areas is an environmental concern. To address this problem, a law for the management of waste was promulgated. Nevertheless, despite government efforts, the issue continues to aggravate with time. Another dilemma that affects our territory is that many regions are flood-prone. Together, solid waste and seasonal floods result in blockages of the drainage systems in cities, which in turn leads to the stagnation of large amounts of water and inundations. To mitigate the risk of inundations caused by solid waste accumulation, we developed a game-based service. The name of the ludic tool that we developed for this purpose is Wood of War: a pervasive, mobile serious game that motivates players to register places with a high concentration of solid waste. The service works as follows: first, we contrast game-generated registers with information of rainwater flow to determine high-risk zones and to create heat maps; then, we present the maps to the corresponding (local) authorities, so that they may optimize their garbage collecting efforts. To explore the viability of our approach, we tested our service in a pilot study. Additionally, we conducted interviews with government officials to learn their impressions. In this chapter, we present a summary of the results, a discussion of the benefits and limitations of our project, and our plans to consolidate the service.",NULL,NULL
178,"Tales of Etrya: English Vocabulary Game","Video games are an adequate tool for teaching and learning since they are engaging, motivating and meet new generation preferences and needs. Consequently, video games may be a suitable strategy to use when learning vocabulary of a second language. However, this is only possible when players are in constant practice and interested in playing. Furthermore, attractive aesthetics improve the quality of the game and makes it more compelling to players. In this paper, the first level of Tales of Etrya (ToE) is presented. ToE is a user-centred mobile game focused on teaching English vocabulary in context. Additionally, we present an optimisation technique based on Level of Detail (LOD) and Culling Optimisation to achieve an acceptable performance in mobile devices. The game was validated with English teachers and tested by a group of students for validation purposes using the Player Experience Inventory (PXI). Our findings show positive results regarding important aspects for the students motivation such as interest, immersion, aesthetics and game performance. Meanwhile, the testers showed a slightly positive attitude about mastery, autonomy and difficulty of ToE. Finally, we found that the low English level of the testers is an obstacle for achieving incidental learning through a video game. Our work contributes to the development of motivating educational games.",NULL,NULL
179,"Supporting the Co-design of Games for Privacy Awareness","Privacy is a well-known concern connected to teenagers usage of e.g., social media, mobile apps, and wearables. However, providing proper learning in this area is challenging. Games have recently been proposed as a tool to increase awareness of privacy concerns. It is important that these games are relevant and engaging. In this paper, we present a workshop to involve teenagers in the co-design of games to promote privacy awareness, describing the workshop process together with the cards and the board that support the process. We evaluated the workshop together with students between 1517 years of age divided in groups of 34 participants. Results show that all the groups were able to generate interesting game ideas and the workshop was perceived as entertaining.",NULL,NULL
180,"Experience Analysis for the Use of Desafiate Serious Game for the Self-assessment of Students","In recent years, the development and use of serious games for the educational field has proliferated. One of the aspects linked to this phenomenon is the motivation achieved with the activities offered in them. On the other hand, there is another technology that has been growing for some time now, which are the Virtual Learning and Teaching Environments (VLTEs). These environments allow carrying out various activities and usually include self-assessment. In this article, we analyze the use of the serious mobile game Desafiate, aimed at student self-assessment and integrated into the IDEAS VLTE. The analysis is based on the intrinsic motivation achieved when using this game, compared to other methods used for self-assessment. Three contrasting groups are used for the analysis  one of them uses the serious game, another one uses pen and paper for their self-assessment, and the third one uses the IDEAS VTLE (and its assessment tool). As an instrument to measure intrinsic motivation, the Intrinsic Motivation Inventory (IMI) questionnaire is used. This questionnaire considers utility, perceived usefulness, pressure/tension, and effort during the activity as variables that affect motivation, among other factors that are not contemplated in this work. Results show that students value self-assessment as a useful activity, and they have shown greater interest in this process when working with Desafiate.",NULL,NULL
181,"Experiences of Multimodal Teaching Through a Serious Game: Meanings, Practices and Discourses","The aim of this chapter is to report on school teachers perceptions and approaches to multimodality using a serious game. STEAM is a game designed for helping school teachers to gain awareness of how multimodality may be enacted in the classroom for enhancing the student learning experience. The game embraces the notion of multimodal teaching and learning, as a way to present multiple representations of content such as text, images, video, audio and pervasive media, by augmenting modes with tools, teaching strategies and locations as means to create ideational, interpersonal and textual meanings. A questionnaire was employed to school teachers ( n =54) for understanding how multimodality was experienced through using the serious game as (1) stipulating diversity and increasing knowledge retention, (2) developing senses for attaining deeper understanding of the subject topic, (3) involving students into learning design and (4) supporting students autonomy and self-direction. The findings revealed an explicit connection between theory and practice as experienced through the games semiotic domain whilst contemplating on attempts to transcend experiences of in-game multimodality to lived classrooms.",NULL,NULL
