paper_id,paper_title,abstract,type,pubmed_id
339,"Designing Collaborative Strategies Supporting Literacy Skills in Children with Cochlear Implants Using Serious Games","Literacy is a process where children with auditory impairments face serious difficulties in acquiring oral language, due to they must learn to listen each one of the phonetic sounds that are part of one word, so that they can learn to pronounce it and write it. Collaborative Learning (CL) applied in literacy teaching may be very favorable for childrens learning. Therefore, a model is proposed to design collaborative strategies using serious games. The model is applied to a case study that was carried out with a group of 14 children with cochlear implants, in the pre-kinder and transition stages at Institute of Blind and Deaf Children of Cauca Valley (INCSVC), in Cali, Colombia, where a collaborative serious game called Phonomagic (Fono-Mgica in spanish) was designed using a learning method called invariant method, which teachers use in the process of literacy learning to children with cochlear implant. FonoMagic is a serious game, which is formed by a physical board and a digital application, that allow children to interact with the application through activities such as completing words, recognizing sounds or identifying vowels and consonants.",NULL,NULL
340,"MiniColon; Teaching Kids Computational Thinking Using an Interactive Serious Game","Computer science is about learning how to think. It is applicable to everything. Most industries in the 21 $$^{st}$$ century are directed towards digitized processes using up-to-date technologies. This increases the need for students to know how these technologies work, especially with the availability of smart and handy devices. As a preliminary step to learning programming, students should learn basics of logical and computational thinking. Computational thinking compromises the skills, concepts, and behaviors used to solve problems. Some visual platforms, such as Scratch and Alice [ 6 , 17 ], were introduced to teach children programming. The platform introduced in this paper aims at teaching young children (in the age range of 89 years old) the preliminary concepts of programming including sequential blocks , conditional blocks , and iterative blocks . This is achieved through an interactive, gesture-based game, where the Kinect Sensor device is used to control the gameplay instead of playing it using a normal PC. The game was tested using a between-group experimental model with two subgroups; an experimental group and a control group. The experimental group used the game whereas the control group was taught using a traditional educational method. The results showed a significant difference between the two groups with a P-value of < 0.05 for both the learning gain and the engagement level.",NULL,NULL
341,"Supporting the Adaptive Generation of Learning Game Scenarios with a Model-Driven Engineering Framework","Learning games are promising methods for autism therapy. In this context, our research project aims to propose an escape-room game for helping children with Autistic Syndrome Disorder (ASD) to learn visual performance skills. Given the specific needs of the intended players, the generation of learning scenarios has to be adaptive. For that, our proposal relies on Model Driven Engineering techniques to deal with dynamic scenarization instead of implementing fixed configurations of scenarios. Our approach proposes to express the game description components and child profiles as models from which adapted scenarios can be automatically generated by means of model transformations. In addition, an iterative co-design process based on rapid prototyping is introduced. It allows ASD experts to take part in the design activity and get fast feedback.",NULL,NULL
342,"A methodology for assessing the effectiveness of serious games and for inferring player learning outcomes","Although serious games are proven to serve as educational tools in many educational domains, there is a lack of reliable, automated and repeatable methodologies that measure their effectiveness: what do players know after playing serious games? Do they learn from them? Previous research shows that the vast majority of serious games are assessed by using questionnaires, which is in stark contrast to current trends in the video game industry. Commercial videogame developers have been learning from their players through Game Analytics for years via non-disruptive game tracking. In this paper, we propose a methodology for assessing serious game effectiveness based on non-disruptive in-game tracking. The methodology involves a design pattern that structures the delivery of educational goals through a game. This structure also allows one to infer learning outcomes for each individual player, which, when aggregated, determine the effectiveness of a serious game. We tested the methodology by having 320 students play a serious game. The proposed methodology allowed us to infer players learning outcomes, to assess the game effectiveness levels and to identify issues in the game design.",NULL,NULL
343,"just Physio kidding - NUI and Gamification based Therapeutic Intervention for Children with Special Needs","This paper presents the just Physio kidding approach, which intends to improve the engaging qualities of therapy programmes towards children with special needs, mainly with cerebral palsy, spinal muscular atrophy, or developmental delay. Therefore, just Physio kidding intends to address both physiotherapy and cognitive stimulation therapy. The system is functioning as a complement to the work of therapists, with and without their live supervision. It is part of a project with the aim of developing software based on the concept of personalized serious games for rehabilitation. The paper presents the concept and the prototype behind just Physio kidding.",NULL,NULL
344,"Exploration of Serious Games on Environmental Issues","Nowadays, the environmental problems for which the world is going through has generated several actions aimed at generating environmental education, using various means to achieve it. One of the tools that education and publicity among other areas are using are serious games, which has gained popularity, being used in various sectors such as education, trade, health, environment and others because they add entertainment to communication processes or educational. Serious games are used as one way to sensitize people about the depletion of natural resources and the consequences of environmental imbalance. Serious games are used as one means to sensitize people about the depletion of natural resources and the consequences of environmental imbalance. This article presents an exploration of serious games focused on environmental issues as well as identifying some of its features and opportunities for improvement. This paper presents a serious exploration of games applied to the area of education and environmental awareness, identifying elements that will be useful when developing technological tools such as initiatives and innovations in environmental education is presented.",NULL,NULL
345,"Serious Games and Motivation","Serious games are gaining a lot of interest in education because they are effective learning tools that engage and motivate students. However, serious games are not ad-hoc motivational but they must follow specific elements to assure motivation. There are several types of motivation that reinforce the effectiveness of serious games and engage students to the task. When these types are combined they provide high learning outcomes. The preliminary study examines how primary school teachers apprehend serious games and how their concepts are related with intrinsic motivation. The findings of the current study provide clear evidence that teachers believe that serious games intrinsically motivate students to learn by developing significant learning skills.",NULL,NULL
346,"The GazePlay Project: Open and Free Eye-Trackers Games and a Community for People with Multiple Disabilities","In order to develop and enhance an augmentative and alternative communication (AAC), gaze is often considered as one of the most natural way and one of the easiest to set up in order to support individuals with multiple disabilities to interact with their environment. For children who start naturally from scratch, who have in addition such difficulties, it is a strong challenge even to acquire or to support the required basic knowledge. Games are often considered a good way to learn. Games designed for eye-trackers, i.e. electronic devices able to compute the position of the gaze, allow children to discover the power of their eyes and the consequences of the actions triggered by their gazes. Video games can be a good way to improve basic requirements as gaze fixation and gaze pursuit as well as conventions like rewards or dwell interactions often used in AAC tools. In this article, we present the GazePlay project which main contribution is a free and open-source software which gathers several mini-games playable with all eye-trackers including low costones.",NULL,NULL
347,"A Board Game Designing of Serious Mini Game in Complementary Colors","With the advent of the era of multiple learning, the game-based teaching provided has also being increasingly diversified. However, in game-based learning, there may be fewer games concerning complementary colors. Nevertheless, the basic knowledge about colors is associated with students development. Therefore, this study mainly investigated, developed, and designed the game based on the concept of complementary colors in chromatics. This study attempted to integrate game concepts with teaching. In particular, the features of Serious Mini games are simple and easy-to-learn. This study used the basic knowledge of complementary colors as the rules, and integrated them with Serious Mini game, which was divided into 5 stages: definition, testing & modification, modification & game rule setting, second testing, and completion. This study explained each stage phase by phase, and predicted the effect after the actual future introduction.",NULL,NULL
348,"A Systematic Mapping of Game-Based Methods to Tackle a Public Health Problem","Mosquito-borne diseases, such as dengue, endanger about half of the worlds population. Their spread is affected by individual behavior in our mostly urban society. Public health policies generally include awareness campaigns on the control of the vectors. While game-based initiatives are developed and used to train students and professionals, support patients and educate citizens, public health education remains neglected. In this study, we identify game-based approaches to support education about diseases transmitted by Aedes mosquitoes. We carried out a systematic mapping to identify studies which address a proposal, use or contain an evaluation of game-based methods, aiming to raise awareness and promote behavior changes regarding dengue and its prevention. Only 12 papers met the criteria for inclusion and exclusion, and those were selected and categorized. As part of an ongoing project, next steps include adding other databases and other mosquito-borne diseases (e.g., malaria) and drafting guidelines to support the design of games for public health education about mosquito-borne diseases.",NULL,NULL
349,"Learning Curve Analysis in a Large-Scale, Drill-and-Practice Serious Math Game: Where Is Learning Support Needed?","This paper applies data-driven methods to understand learning and derives game design insights in a large-scale, drill-and-practice game: Spatial Temporal (ST) Math. In order for serious games to thrive we must develop efficient, scalable methods to evaluate games against their educational goals. Learning models have matured in recent years and have been applied across e-learning platforms but they have not been used widely in serious games. We applied empirical learning curve analyses to ST Math under different assumptions of how knowledge components are defined in the game and map to game contents. We derived actionable game design feedback and educational insights regarding fraction learning. Our results revealed cases where students failed to transfer knowledge between math skills, content, and problem representations. This work stresses the importance of designing games that support students comprehension of math concepts, rather than the learning of content- and situation-specific skills to pass games.",NULL,NULL
350,"An Approach to Mobile Serious Games Accessibility Assessment for People with Hearing Impairments","Serious games allow educating in a fun way in different areas and its development in mobile devices has been growing since the advent of smartphones. However, accessibility for people with hearing impairments has not been considered as a necessary element in the development of this type of video games. Unfortunately, there is no model for assessing the accessibility of serious games for people with hearing impairments, although some video games development companies recommend general guidelines for the construction of these applications. This paper presents a compilation and analysis of the current accessibility guidelines for the development of video games for people with hearing impairments. As a case study, an assessment of a mobile game is made to identify its level of accessibility. An analysis tool for those who wish to develop or evaluate serious games for people with hearing impairments on mobile devices is proposed.",NULL,NULL
351,"A Serious Game to Promote Environmental Attitude","Environmental attitudes are essential for the todays world in which shrinking natural resources and pollution are one of the biggest problems of the society. The research challenges go in two directions: on the one hand, the environmental researchers try to reduce the impact of human actions on the environment and, on the other, human researchers try to educate people to adopt ecological behaviour. This is the main issue faced in this research to sensitize young people to the environmental health using multimedia technologies. The paper presents a serious game addressed to primary school pupils aimed at transferring knowledge about marine litter and four species of Mediterranean Sea that are estimated to be at risk of extinction. The aim is to foster knowledge about the marine life and to explain people the problems that marine litter can cause. The results of a pilot study that investigates the usability of the game is presented.",NULL,NULL
352,"An Overview of Location-Based Game Authoring Tools for Education","Nowadays, computer literacy is common at a very early age. As mobile devices and new social communication trends are increasingly integrating in the modern digital lifestyle new opportunities arise for harnessing this potential for innovative serious purposes. Location-based games that layer educational activities with game play can help players gain a new perspective through active engagement. In this paper, a range of key issues for implementing location based games for educational purposes using the two most commonly used open source authoring tools ARIS and TaleBlazer are presented. Although the reviewed authoring tools vary in functionality, they share a fairly common conceptual model and in both cases the software architecture is comprised of the same components. Both platforms provide the required game mechanics to create sophisticated gameplay interactions and game logic extension. However, a number of issues should be carefully considered. The conceptual models are analyzed with a critical view, pointing out limitations and challenges that can inform the design and implementation of next generation authoring tools.",NULL,NULL
353,"Games for Knowledge Transfer and as a Stimulus for Climate Change Mitigation in AgricultureLessons Learned from a Game Prototype","Transferring complex scientific knowledge into practice is challenging. This is also the case for know-how on climate change (CC) mitigation in the agricultural sector, which is held responsible for approximately 10% of global greenhouse gas emissions. Even though numerous mitigation options at the farm level have already been identified, they still lack broad implementation. Serious games have increasingly gained attention as a medium for knowledge transfer on CC mitigation. This paper analyses if such games are also helpful for the transfer of mitigation and adaption knowledge to the actors of the agricultural sector. The paper starts with a short introduction of characteristics of serious games, and an overview of published games on CC with a focus on agriculture. It then presents a game prototype where the players act as farmers who invest a given budget into their choice of CC mitigation measures. Yet, the prototype focuses on mitigation in industrialized agriculture. It was exemplarily played by different target groups (interested lay people, stakeholders). The paper qualitatively presents lessons learned from this attempt to communicate the complex topic via a game approach. These include accounting for previous knowledge, and safeguarding of core messages. This paper might help others who are considering games as a way to communicate their findings.",NULL,NULL
354,"Characterization of the Serious Games Applied to the Historical Heritage","At present, interest in the dissemination and appropriation of cultural heritage has increased considerably, seeking to understand the history of the people and make it socially valued. To achieve this goal, technology has become a tool that allows venture and innovate strategies and tools that support these processes of socialization. In this sense serious games, constitute a tool that provides added value to the game, plus the amuse. In the process of dissemination of cultural heritage, serious games are used for events and historical facts of which the ancestors were protagonists are known. In this paper, the results of a process of exploration and systematic review of different games focused on the theme, presenting the characteristics and priority and relevant elements for a serious game used in the dissemination of historical heritage meets the objective of socialized educate, inform and entertain the user, without forgetting the important role of transmitting the culture of the place and training with the inclusion of technologies. Another result, serious games can be placed as critical elements in which the quality of cultural learning is assumed, that is why it is of great interest to apply a model with the specific characteristics and elements that ensure quality and main objective of a serious patrimonial and historical games.",NULL,NULL
355,"Game Over or Jumping to the Next Level? How Playing the Serious Game Mobility Safari Instigates Social Learning for a Smart Mobility Transition in Vienna","Serious games and gaming are increasingly considered as the magic bullet for improved stakeholder involvement and citizen engagement in urban planning and governance. They are also discussed as means to instigate learning and capacity building and to raise the awareness of citizens and stakeholders about various urban topics. These learning processes can unfold in various different formats, such as social or game-based learning. This chapter investigates if playing the serious game prototype Mobility Safari supports such processes. Mobility Safari is a serious-game prototype developed for the City of Vienna. The game is targeting Viennas ambition to become a smart city. One focal point of this ambition concerns the change towards a more sustainable mobility system. Our analysis illustrates that the serious game indeed evokes learning processes during the gameplay and the debriefing, covering a broad range of learning activities and social interaction. Incomplete rule-sets and un-governed situations trigger discussions in which players confront the game experience with their actual real-world practices. Our analysis suggests that games are indeed suitable means for informing citizens and supporting capacity-building processes in participatory-planning approaches. However, they need a careful design, facilitation and sufficient time for a debriefing so that players can reflect on the game experience. This reflection is crucial to transform the game experience into a deeper learning experience that is meaningful for real-world contexts.",NULL,NULL
356,"GAP: A Game for Improving Awareness About Passwords","Text-based password is the most popular method for authenticating users on the internet. However, despite decades of security research, users continue to choose easy-to-guess passwords to protect their important online accounts. In this paper, we explore the potential of serious games to educate users about various features that negatively impact password security. Specifically, we designed a web-based casual game called GAP and assessed its impact by conducting a comparative user study with 119 participants. The study results show that participants who played GAP demonstrated improved performance in recognizing insecure password features than participants who did not play GAP . Besides having educational value, most of the participants also found GAP fun to play.",NULL,NULL
357,"A Hybrid Virtual-Augmented Serious Game to Improve Driving Safety Awareness","The use of 3D virtual content and Augmented Reality (AR) in certain applications allows designing tools and serious games that are more attractive to the potential users. Focusing on the area of learning and education, these technologies can be adapted to the requirements of the application that needs to be developed, to the available devices on which they are expected to run and also to the learning content. However, in most applications only a single interaction paradigm and a single visualization mode is used, restricting the potential benefits of the system. In this paper, we propose a software application designed to improve driving safety awareness and learning for both adults and children, in which we combine different interaction and visualization modes. The application is shaped as a hybrid virtual-augmented Game of the Goose in which AR, tactile interaction and 3D virtual content are brought to the user in a combined but meaningful way. The combination of these different interaction paradigms creates an educational tool which is much more intuitive and engaging. In this serious game, multiple players/users can participate simultaneously and players obtain, on the one hand, an intuitive interaction, simple and realistic based on AR and, on the other hand, an increase in the sense of immersion by means of virtual content, for a given set of driving-related situations. This provides a much more tailored learning system, making the users focus in the given driving situations. The paper describes the objectives set in the development of the application, the design and implementation decisions taken and a comprehensive but preliminary assessment performed with 285 users which provides satisfactory and promising results.",NULL,NULL
358,"The Effect of Emotions and Social Behavior on Performance in a Collaborative Serious Game Between Humans and Autonomous Robots","The aim of this paper is to investigate performance in a collaborative humanrobot interaction on a shared serious game task. Furthermore, the effect of elicited emotions and perceived social behavior categories on players performance will be investigated. The participants collaboratively played a turn-taking version of the Tower of Hanoi serious game, together with the human and robot collaborators. The elicited emotions were analyzed in regards to the arousal and valence variables, computed from the Geneva Emotion Wheel questionnaire. Moreover, the perceived social behavior categories were obtained from analyzing and grouping replies to the Interactive Experiences and Trust and Respect questionnaires. It was found that the results did not show a statistically significant difference in participants performance between the human or robot collaborators. Moreover, all of the collaborators elicited similar emotions, where the human collaborator was perceived as more credible and socially present than the robot one. It is suggested that using robot collaborators might be as efficient as using human ones, in the context of serious game collaborative tasks.",NULL,NULL
